h1,google-anal,title,h2,text,description,keywords
,"<script src=""catalog/view/javascript/jquery/jquery-2.1.1.min.js"" type=""text/javascript""></script>,<script src=""catalog/view/javascript/bootstrap/js/bootstrap.min.js"" type=""text/javascript""></script>,<script src=""catalog/view/javascript/jquery/swiper/js/swiper.jquery.js"" type=""text/javascript""></script>,<script src=""catalog/view/javascript/common.js"" type=""text/javascript""></script>,<script>
  (function(i,s,o,g,r,a,m){i['GoogleAnalyticsObject']=r;i[r]=i[r]||function(){
  (i[r].q=i[r].q||[]).push(arguments)},i[r].l=1*new Date();a=s.createElement(o),
  m=s.getElementsByTagName(o)[0];a.async=1;a.src=g;m.parentNode.insertBefore(a,m)
  })(window,document,'script','https://www.google-analytics.com/analytics.js','ga');

  ga('create', 'UA-105929654-1', 'auto');
  ga('send', 'pageview');

</script>",ООО Кузнецовский фарфор,"Фарфор ручной работы,Специальные предложения:,Эксклюзивный дизайн от Кузнецовского фарфора,Наши преимущества,Почему стоит брать фарфор?,Преимущества фарфора,Производство,Спец предложения ,Контакты,Магазин,Обратная связь:","Корзина,Производим с 1832 года, качество,проверенное временем. Мы выполняем,заказы как для частных лиц, так и для,государственных учреждений.,Сервиз столовый рисунок ""Дарственный"" с вензелем,Сервиз кофейный 15 штучный рисунок ""Весенний сад"",За 20 лет работы «Кузнецовский фарфор» зарекомендовал
себя как востребованный поставщик фарфоровых изделий.
Деятельность компании направлена на создание и разработку
уникальных и неповторимых своей сложностью в изготовлении
изделий, стильных и нестандартных дизайнерских рисунков по
изготовленным изделиям.,
Мы считаем, что простота, качество
и мастерство - это принципы лучшего образа жизни во все
времена. Начиная от маленьких фарфоровых статуэток до
больших фарфоровых сервизов, для всех изделий отлиты формы
нашими мастерами ,каждый обжиг происходит в специально изготовленных
печах. Каждая часть ручной работы несет в себе историю, которая придает смысл,
аутентичность и грацию для любого, купившего себе этот кусочек многовековой истории,Качество:,
Каждая тарелка и кружка подвергается контролю качества. Мастер проверяет тщательно продукцию на
мелкие трещины и дефекты, и при малейшем отклонении изделие отправляется обратно на доработку.
Мы добиваемся того, чтобы на выходе вы получили лучшее фарфоровое изделие с фирменным знаком качества
«Кузнецовский фарфор».
,Надежность:,
Наши мастера несут полную ответственность за производимую продукцию.
Вы всегда можете быть уверены в высокой квалификации наших работников и высоком уровне
приобретаемых изделий
,Стиль:,
Благодаря современному и нестандартному подходу наших дизайнеров, мы гарантируем
что ваше изделие из фарфора будет полностью уникальным и невероятно стильным
в оформление вашего декора.
,
Фарфоровый набор посуды благодаря своей прочности прослужат долгие годы вам
и вашим поколениям. Наборы и изделия из фарфора, же не содержит BPA компоненты,
поэтому нет необходимости беспокоиться о том, что BPA просачивается в пищу или напитки,
как с некоторыми пластиковыми посудами и контейнерами.
,
Набор посуды из фарфора можно безопасно использовать в морозильной камере,
микроволновой печи и духовке. Набор посуды может выдерживать температуру свыше
500 градусов.Более того, набор посуды можно мыть в посудомоечной машине,
что делает уборку мгновенной.
,НАТУРАЛЬНОСТЬ И ,
,ЭКОЛОГИЧНОСТЬ МАТЕРИАЛА,
Сейчас все больше заводов, выпускает со своих конвейеров дешевую некачественную,
а порой даже состоит из опасный для нашего здоровья материалов. Все больше людей ценят
подарки самой природы, и стараются окружать свой дом природными материалами.
Каждое изделие состоит из натурального сырья.
,ЭСТЕТИЧНОСТЬ,
Об эстетике фарфора, художественной и исторической ценности изделий из этого материала можно
говорить часами. На сегодняшний день существует большое количество вариантов создание посуды,
но не один не сравнится по изяществу исполнения с фарфором.
,ПРАКТИЧНОСТЬ И ДОЛГОВЕЧНОСТЬ,
Основные характеристики такие, как морозостойкость, термостойкость, влагостойкость и гигиеничность,
фарфор приобретает после обжига и глазирования. В связи с этим фарфор - это уникальный по своим свойствам
материал, из которого можно создавать будь то миниатюрные или это будут большие по своим размерам изделия.
Фарфор не впитывает в себя различного рода загрязнения, что позволяет легко избавится от них, сохраняя
первозданную красоту
домашнего очага.

,ЭКСКЛЮЗИВНОСТЬ,
Изготовление фарфоровой посуды состоит из самых разных элементов ручной работы. Уникальность
каждого элемента в целом зависит от линий, нарисованных кистью в руках художника, от переливов глазури,
от освещения, от поведения каждого куска натурального материала, используемого в производстве. Даже две
фарфоровые статуэтки одинакового дизайна будут иметь свои индивидуальные особенности благодаря ручной
работе мастера.
,Записаться на экскурсию,можно по телефонам:,+7(496)416-10-89,+7(496)414-08-84 ,Набор для вина 8 штучный рисунок ""Разнотравие"",Набор винный 8 штучный рисунок ""Дарственный"",Набор винный 8 штучный рисунок ""Рябина"", kyznecovsky.farfor@yandex.ru,+7(496)416-10-89,+7(496)414-08-84,&copy Кузнецовский фарфор 2015-2016 Все права защищены","My Store, Начиная от маленьких фарфоровых статуэток до больших фарфоровых сервизов, для всех изделий отлиты формы нашими мастерами ,каждый обжиг происходит в специально изготовленных печах.","Кузнецовский фарфор, фарфоровый завод , фарфоровые изделия на заказ"
